{
  "version": 1,
  "generatedAt": "2026-03-28T12:30:00Z",
  "purpose": "Public-safe status view for the first U.S. sector-regime depth wave inside OpenCompliance. It shows the current narrow overlap for HIPAA Privacy and Breach, GLBA and NYDFS, and CCPA/CPRA without pretending that the whole regulatory corpus is already mechanised.",
  "programs": [
    {
      "programId": "hipaa_privacy_and_breach",
      "title": "HIPAA Privacy and Breach mapping program",
      "frameworks": [
        {
          "framework": "HIPAA Privacy Rule",
          "priorityRank": 38,
          "priorityTier": "market_triggered",
          "sourceAvailability": "public_exact_feasible",
          "openComplianceState": "priority_backlog",
          "mappedPublicControls": 2,
          "implementedPublicControls": 2,
          "plannedPublicControls": 0,
          "leanBackedPublicControls": 0,
          "exactAnchorStatusCounts": {
            "public_source_reviewed": 2,
            "candidate_public_source_unreviewed": 0,
            "blocked_nonpublic_source_review": 0
          },
          "nextDepthControlIds": [
            "oc.privacy-04",
            "oc.vendor-02"
          ]
        },
        {
          "framework": "HIPAA Breach Notification Rule",
          "priorityRank": 39,
          "priorityTier": "market_triggered",
          "sourceAvailability": "public_exact_feasible",
          "openComplianceState": "priority_backlog",
          "mappedPublicControls": 2,
          "implementedPublicControls": 2,
          "plannedPublicControls": 0,
          "leanBackedPublicControls": 0,
          "exactAnchorStatusCounts": {
            "public_source_reviewed": 2,
            "candidate_public_source_unreviewed": 0,
            "blocked_nonpublic_source_review": 0
          },
          "nextDepthControlIds": [
            "oc.ir-01",
            "oc.ir-02"
          ]
        }
      ],
      "summary": {
        "frameworksInScope": 2,
        "frameworksWithCurrentMappings": 2,
        "uniqueMappedPublicControls": 4,
        "uniqueImplementedPublicControls": 4,
        "uniquePlannedPublicControls": 0,
        "uniqueLeanBackedPublicControls": 0,
        "reviewedExactAnchorEntries": 4,
        "candidateExactAnchorEntries": 0,
        "blockedExactAnchorEntries": 0,
        "nextDepthControlCount": 4,
        "routeCounts": {
          "decidable": 0,
          "attestation": 4,
          "judgment": 0,
          "mixed": 0
        }
      },
      "workstreams": [
        {
          "id": "authoritative_public_source_decomposition",
          "title": "Public-law and regulation decomposition",
          "status": "partial",
          "summary": "The current wave tracks 2 public-source frameworks and already has 2 with normalized public-control overlap.",
          "remainingWork": "Widen the current narrow overlap into a fuller obligation graph without collapsing rights, notification, and documentary requirements into fake machine proof.",
          "blockedBy": []
        },
        {
          "id": "public_control_normalization",
          "title": "Public-control normalization",
          "status": "partial",
          "summary": "4 unique public controls currently overlap this program, with 4 already exercised by fixtures.",
          "remainingWork": "Promote the next narrow controls only when their route, exact-anchor, and claim-schema boundaries are stable enough to stay honest.",
          "blockedBy": []
        },
        {
          "id": "exact_anchor_review",
          "title": "Reviewed exact-anchor corridor",
          "status": "partial",
          "summary": "The current wave records 4 reviewed exact-anchor entries and 0 candidate entries across the in-scope frameworks.",
          "remainingWork": "Increase reviewed exact-anchor coverage while keeping gaps explicit and resisting family-proxy inflation.",
          "blockedBy": []
        },
        {
          "id": "typed_claim_coverage",
          "title": "Typed claim coverage",
          "status": "partial",
          "summary": "The current overlap splits into 0 decidable, 4 attestation, and 0 judgment controls.",
          "remainingWork": "Close the next typed evidence and attestation gaps before widening the public verifier surface for these regimes.",
          "blockedBy": []
        },
        {
          "id": "lean_coverage",
          "title": "Lean coverage",
          "status": "not_started",
          "summary": "0 currently overlapped controls are Lean-backed in the public corridor.",
          "remainingWork": "Keep Lean usage narrow and technical: only widen it where the regime obligation really reduces to a decidable systems claim.",
          "blockedBy": []
        },
        {
          "id": "fixture_rollout",
          "title": "Fixture rollout",
          "status": "complete",
          "summary": "4 of 4 mapped controls currently appear in public fixture corridors.",
          "remainingWork": "Turn the next rights, vendor, breach, and retention slices into replayable fixture-backed corridors instead of documentation-only backlog.",
          "blockedBy": []
        },
        {
          "id": "external_review",
          "title": "External review",
          "status": "program_defined",
          "summary": "A dedicated sector-regime review program now defines the reviewer roles and pass gates for health, finance, and California privacy-law scrutiny.",
          "remainingWork": "Run the review program with sector-specialist counsel, operators, and privacy engineers once the next control wave is ready.",
          "blockedBy": []
        }
      ],
      "publicNotes": [
        "This wave intentionally starts with HIPAA Privacy and Breach Notification rather than claiming the full HIPAA Security Rule technical corridor is already normalized.",
        "A mapped control here means a narrow documentary or workflow slice, not that HIPAA compliance is fully mechanised or certified."
      ]
    },
    {
      "programId": "financial_services_glba_nydfs",
      "title": "GLBA and NYDFS mapping program",
      "frameworks": [
        {
          "framework": "GLBA Safeguards Rule",
          "priorityRank": 40,
          "priorityTier": "market_triggered",
          "sourceAvailability": "public_exact_feasible",
          "openComplianceState": "priority_backlog",
          "mappedPublicControls": 6,
          "implementedPublicControls": 6,
          "plannedPublicControls": 0,
          "leanBackedPublicControls": 3,
          "exactAnchorStatusCounts": {
            "public_source_reviewed": 6,
            "candidate_public_source_unreviewed": 0,
            "blocked_nonpublic_source_review": 0
          },
          "nextDepthControlIds": [
            "oc.id-01",
            "oc.log-01",
            "oc.net-01",
            "oc.data-05",
            "oc.ir-01",
            "oc.vendor-02"
          ]
        },
        {
          "framework": "NYDFS 23 NYCRR Part 500",
          "priorityRank": 41,
          "priorityTier": "market_triggered",
          "sourceAvailability": "public_exact_feasible",
          "openComplianceState": "priority_backlog",
          "mappedPublicControls": 7,
          "implementedPublicControls": 7,
          "plannedPublicControls": 0,
          "leanBackedPublicControls": 3,
          "exactAnchorStatusCounts": {
            "public_source_reviewed": 7,
            "candidate_public_source_unreviewed": 0,
            "blocked_nonpublic_source_review": 0
          },
          "nextDepthControlIds": [
            "oc.id-01",
            "oc.log-01",
            "oc.net-01",
            "oc.data-05",
            "oc.ir-01",
            "oc.ir-02",
            "oc.vendor-02"
          ]
        }
      ],
      "summary": {
        "frameworksInScope": 2,
        "frameworksWithCurrentMappings": 2,
        "uniqueMappedPublicControls": 7,
        "uniqueImplementedPublicControls": 7,
        "uniquePlannedPublicControls": 0,
        "uniqueLeanBackedPublicControls": 3,
        "reviewedExactAnchorEntries": 13,
        "candidateExactAnchorEntries": 0,
        "blockedExactAnchorEntries": 0,
        "nextDepthControlCount": 7,
        "routeCounts": {
          "decidable": 3,
          "attestation": 4,
          "judgment": 0,
          "mixed": 0
        }
      },
      "workstreams": [
        {
          "id": "authoritative_public_source_decomposition",
          "title": "Public-law and regulation decomposition",
          "status": "partial",
          "summary": "The current wave tracks 2 public-source frameworks and already has 2 with normalized public-control overlap.",
          "remainingWork": "Widen the current narrow overlap into a fuller obligation graph without collapsing rights, notification, and documentary requirements into fake machine proof.",
          "blockedBy": []
        },
        {
          "id": "public_control_normalization",
          "title": "Public-control normalization",
          "status": "partial",
          "summary": "7 unique public controls currently overlap this program, with 7 already exercised by fixtures.",
          "remainingWork": "Promote the next narrow controls only when their route, exact-anchor, and claim-schema boundaries are stable enough to stay honest.",
          "blockedBy": []
        },
        {
          "id": "exact_anchor_review",
          "title": "Reviewed exact-anchor corridor",
          "status": "partial",
          "summary": "The current wave records 13 reviewed exact-anchor entries and 0 candidate entries across the in-scope frameworks.",
          "remainingWork": "Increase reviewed exact-anchor coverage while keeping gaps explicit and resisting family-proxy inflation.",
          "blockedBy": []
        },
        {
          "id": "typed_claim_coverage",
          "title": "Typed claim coverage",
          "status": "partial",